Title,Price,InStock,Description,Link,Processor,Memory,Storage,Graphics
"Spirit of Gamer AirBlade 100 - 1.6 Inch - Blue  LF-37-R ","320 LE","N/A"," Spirit of Gamer, AIRBLADE 100 RED  -Up to  15,6 laptops Max cooling efficiency and dynamic cold air Flow with 2 silent 120 mm led fans/ Metallic and ABS structure /Adjustable angle from 6 to 28° USB Braided nylon cable included 2 USB ports for maximum efficiency: Air Blade 100 is powered by your laptop via USB (5V): it requires no power adapter. Ergonomic design with 5 adjustable positions: Air Blade 100 offers true visual comfort avoiding uncomfortable and painful postures. Adjust the inclination as needed, from 6 ° to 28 °. Fan speed dimmer Nylon cable 2 USB ports  ","https://www.sigma-computer.com/item?id=3582&name=Spirit_of_Gamer_AirBlade_100_-_1.6_Inch_-_Blue__LF-37-R_","N/A","N/A","N/A","N/A"
"Spirit of Gamer AirBlade 100 - 1.6 Inch - Blue  LF-37-B  ","275 LE","N/A"," Spirit of Gamer, AIRBLADE 100 RED  -Up to  15,6 laptops Max cooling efficiency and dynamic cold air Flow with 2 silent 120 mm led fans/ Metallic and ABS structure /Adjustable angle from 6 to 28° USB Braided nylon cable included 2 USB ports for maximum efficiency: Air Blade 100 is powered by your laptop via USB (5V): it requires no power adapter. Ergonomic design with 5 adjustable positions: Air Blade 100 offers true visual comfort avoiding uncomfortable and painful postures. Adjust the inclination as needed, from 6 ° to 28 °. Fan speed dimmer Nylon cable 2 USB ports  ","https://www.sigma-computer.com/item?id=3581&name=Spirit_of_Gamer_AirBlade_100_-_1.6_Inch_-_Blue__LF-37-B__","N/A","N/A","N/A","N/A"
"HP Pavilion Gaming Laptop 15-dk2044nia Core i7-11370H RAM 16 GB 256 GB SSD 1 TB HDD 15.6 FHD 144Hz IPS RTX 3050 4GB","21500 LE","N/A"," Learn More about GeForce RTX 30  series: https://fb.watch/9NLKL7MBfn/  Microprocessor  Intel® Core™ i7-11370H (up to 4.8 GHz with Intel® Turbo Boost Technology, 12 MB L3 cache, 4 cores)  Memory, standard  16 GB DDR4-3200 MHz RAM (2 x 8 GB)  Video graphics  NVIDIA® GeForce RTX™ 3050 Laptop GPU (4 GB GDDR6 dedicated)  Hard drive  256 GB PCIe® NVMe™ M.2 SSD  1 TB 7200 rpm SATA HDD  Display  39.6 cm (15.6 ) diagonal, FHD (1920 x 1080), 144 Hz, IPS, micro-edge, anti-glare, 250 nits, 45% NTSC  Operating system  FreeDOS  ","https://www.sigma-computer.com/item?id=3564&name=HP_Pavilion_Gaming_Laptop_15-dk2044nia_Core_i7-11370H_RAM_16_GB_256_GB_SSD_1_TB_HDD_15.6_FHD_144Hz_IPS_RTX_3050_4GB","N/A","N/A","N/A","N/A"
"HP Pavilion Gaming Laptop 15-dk2022nia Core i7-11370H RAM 16GB 512 SSD 1 TB HDD 15.6 FHD 144 HzRTX 3050 4GB","21800 LE","N/A"," Learn More about GeForce RTX 30  series: https://fb.watch/9NLKL7MBfn/  Microprocessor  Intel® Core™ i7-11370H (up to 4.8 GHz with Intel® Turbo Boost Technology, 12 MB L3 cache, 4 cores)  Memory, standard  16 GB DDR4-3200 MHz RAM (2 x 8 GB)  Video graphics  NVIDIA® GeForce RTX™ 3050 Laptop GPU (4 GB GDDR6 dedicated)  Hard drive  512 GB PCIe® NVMe™ M.2 SSD  1 TB 7200 rpm SATA HDD  Display  39.6 cm (15.6 ) diagonal, FHD (1920 x 1080), 144 Hz, 7 ms response time, IPS, micro-edge, anti-glare, 300 nits, 72% NTSC  Operating system  FreeDOS  ","https://www.sigma-computer.com/item?id=3563&name=HP_Pavilion_Gaming_Laptop_15-dk2022nia_Core_i7-11370H_RAM_16GB_512_SSD_1_TB_HDD_15.6_FHD_144_HzRTX_3050_4GB","N/A","N/A","N/A","N/A"
"DATO RAM 32GB DDR4 P2666 NOTEBOOK","2999 LE","N/A"," apacity : 32GB  Frequency : 2666MHz  Use : Laptop  Voltage : 1.2v  Key Features Unbuffered DIMM Non-ECC Datotek retail packing  ","https://www.sigma-computer.com/item?id=3423&name=DATO_RAM_32GB_DDR4_P2666_NOTEBOOK","N/A","N/A","N/A","N/A"
"ASUS TUF Dash F15 M-FX516P Core    i7-11370H RAM 16GB 512SSD Display 15.6sRGB 144Hz IPS RTX    3060 6GB WIN 10","24499 LE","N/A"," Learn More about GeForce RTX 30  series: https://fb.watch/9NLKL7MBfn/  Processor Intel® Core™ i7-11370H Processor 3.3 GHz, 4 cores (12M Cache, up to 4.8GHz) Graphics NVIDIA® GeForce RTX™ 3060 Laptop GPU,With ROG Boost up to 1525MHz at 80W (85W with Dynamic Boost),6GB GDDR6 Display 15.6-inch,FHD (1920 x 1080) 16:9,anti-glare display,sRGB:62.5%,Adobe:47.34%,Refresh Rate:144Hz,Value IPS-level Memory 8GB DDR4 on board,8GB DDR4-3200 SO-DIMM,Max Capacity : 32GB Storage 512GB M.2 NVMe™ PCIe® 3.0 SSD Keyboard and Touchpad Backlit Chiclet Keyboard US Operating System  Windows 10   ","https://www.sigma-computer.com/item?id=3386&name=ASUS_TUF_Dash_F15_M-FX516P_Core____i7-11370H_RAM_16GB_512SSD_Display_15.6sRGB_144Hz_IPS_RTX____3060_6GB_WIN_10","N/A","N/A","N/A","N/A"
"ASUS ROG Zephyrus M16 GU603HM-211.ZM16 Core    i9-11900H RAM 16GB 1TB SSD Display 16 165Hz IPS  2K 3ms RTX    3060 6GB WIN 10","37500 LE","N/A"," Learn More about GeForce RTX 30  series: https://fb.watch/9NLKL7MBfn/Operating System  Windows 10 Home - ASUS recommends Windows 10 Pro for business  Processor  Intel® Core™ i9-11900H Processor 2.5 GHz (24M Cache, up to 4.9 GHz, 8 Cores)  Graphics  NVIDIA® GeForce RTX™ 3060 Laptop GPU  With ROG Boost up to 1525MHz at 80W (95W with Dynamic Boost)  6GB GDDR6  Memory  8GB DDR4 on board  8GB DDR4-3200 SO-DIMM  Storage  1TB M.2 NVMe™ PCIe® 3.0 SSD  Keyboard and Touchpad  Backlit Chiclet Keyboard RGB  Display  16-inch  WQXGA (2560 x 1600) 16:10  anti-glare display  DCI-P3:  100%  Refresh Rate:  165Hz  Response Time:  3ms  IPS-level  Pantone Validated:  Yes    ","https://www.sigma-computer.com/item?id=3385&name=ASUS_ROG_Zephyrus_M16_GU603HM-211.ZM16_Core____i9-11900H_RAM_16GB_1TB_SSD_Display_16_165Hz_IPS__2K_3ms_RTX____3060_6GB_WIN_10","N/A","N/A","N/A","N/A"
"Razer Pro Click High-precision ergonomic wireless mouse for productivity","1599 LE","N/A"," High-precision ergonomic wireless mouse for productivity  Ergonomic design co-designed with Humanscale  Razer™ 5G Advanced Optical Sensor  Extended battery life of up to 400 hours    BEST IN CLASS ERGONOMICS CO-DESIGNED WITH HUMANSCALE  Razer teamed up with Humanscale, the world’s premier experts of office ergonomics to bring you a mouse that is based entirely on the latest human factors research.        POWERED FOR CUTTING-EDGE PRECISION AND ALL-DAY COMFORT AT WORK  Engineered by top ergonomics scientists and designers, its added palm support prevents your wrist from anchoring onto work surfaces, alleviating strain and promoting better arm posture.        ABOUT HUMANSCALE  Humanscale is the leading designer and manufacturer of ergonomic products that improve the health and comfort of work life.           RAZER 5G ADVANCED OPTICAL SENSOR  Its 16,000 DPI sensor ensures even the finest movement of your mouse is tracked, giving you an acute level of precision that maximizes your productivity and efficiency at work.        EXTENDED BATTERY LIFE OF UP TO 400 HOURS  Work without worry. The battery lasts up to 400 hours when connected via Bluetooth, and up to 200 hours when connected via 2.4GHz wireless, allowing you to power through long hours of work.           OTHER FEATURES Durable For up to 50 Million Clicks  Designed as the ultimate go-to mouse for productivity, the switches in the Razer™ Pro Click are durable for up to 50 million clicks, combining performance with longevity.    Multi-host Connectivity for up to 4 Devices  Pair up to 4 devices and conveniently switch between your desktop, laptop, Android tablet or TV screen with just one click, without the constant need to pair and unpair.       8 Programmable Buttons  Power users, now you can work faster and smarter by assigning macros and secondary functions to any of the 8 independently programmable buttons.     ","https://www.sigma-computer.com/item?id=3376&name=Razer_Pro_Click_High-precision_ergonomic_wireless_mouse_for_productivity","N/A","N/A","N/A","N/A"
"Razer Goliathus Mobile Slim and flexible for maximum mobility","250 LE","N/A"," Slim and flexible for maximum mobility  Slim and Flexible for Maximum Mobility  Engineered for Both Speed and Control Playstyles  Optimized Surface for Highly Responsive Tracking    FOR THE HARDCORE ON THE GO    SLIM AND FLEXIBLE FOR MAXIMUM MOBILITY  At a mere 1.5 mm thin, the Razer Goliathus Mobile is easy to carry with you everywhere. You can either place this slim, durable mouse mat between your laptop screen and keyboard, or roll it up and place it in your bag without worrying about it ever warping.   ENGINEERED FOR BOTH SPEED AND CONTROL PLAYSTYLES  Designing a mouse mat for gamers on the go means striking a critical balance of supporting different playstyles on a single mat. The result of extensive research and field-testing is the Razer Goliathus Mobile — fully capable of giving you a smooth glide for swiftness and superb stopping power for control.   OPTIMIZED SURFACE FOR HIGHLY RESPONSIVE TRACKING  Meticulous attention to detail went into the creation of the Razer Goliathus Mobile. The super fine micro texture weave is engineered specifically to work with both optical and laser mouse sensors, providing you with an optimal surface for tournament-grade tracking. Now even the most precise mouse movements you make will be translated accurately on screen  ","https://www.sigma-computer.com/item?id=3363&name=Razer_Goliathus_Mobile_Slim_and_flexible_for_maximum_mobility","N/A","N/A","N/A","N/A"
"ASUS TUF F15-FX506HM-HN039T Corei9-11900H RAM 16GB 1TB SSD RTX 3060 6GB 15.6 FHD 144Hz win10 Eclipse Grey","27900 LE","N/A"," Learn More about GeForce RTX 30  series: https://fb.watch/9NLKL7MBfn/  Processor  Intel® Core™ I9-11900H Processor 2.3 GHz (24M Cache, up to 4.6 GHz, 8 Cores)  Graphic  NVIDIA® GeForce RTX™ 3060 Laptop GPU, 6GB GDDR6  Intel® UHD Graphics  Panel  15.6-inch, FHD (1920 x 1080) 16:9, 144Hz  Display output  1x HDMI 2.0b  Keyboard Type  Backlit Chiclet Keyboard RGB  16GB DDR4 RAM   WINDOWS 10Processor ضمان وكيل سنتين  ","https://www.sigma-computer.com/item?id=3337&name=ASUS_TUF_F15-FX506HM-HN039T_Corei9-11900H_RAM_16GB_1TB_SSD_RTX_3060_6GB_15.6_FHD_144Hz_win10_Eclipse_Grey","N/A","N/A","N/A","N/A"
"ASUS TUF Dash F15 FX516PE-HN023T Core    i7-11370H RAM 16GB 1TB SSD 15.6-inch FHD 144Hz RTX    3050 Ti 4GB WIN10-BLACK","22500 LE","N/A"," Learn More about GeForce RTX 30  series: https://fb.watch/9NLKL7MBfn/  Operating System  Windows 10 Home  Processor Intel® Core™ i7-11370H Processor 3.3 GHz, 4 cores (12M Cache, up to 4.8GHz)  GraphicsNVIDIA® GeForce RTX™ 3050 Ti Laptop GPU,Up to 1585MHz at 60W (75W with Dynamic Boost),4GB GDDR6  Display15.6-inch,FHD (1920 x 1080) 16:9,anti-glare display,Refresh Rate:144Hz,Value IPS-level  Memory 16GB DDR4 on board,16GB DDR4-3200 SO-DIMM,Max Capacity : 32GB 2*8  Storage 1TB M.2 NVMe™ PCIe® 3.0 SSD  Keyboard and Touchpad  Backlit Chiclet Keyboard ضمان وكيل سنتين  ","https://www.sigma-computer.com/item?id=3336&name=ASUS_TUF_Dash_F15_FX516PE-HN023T_Core____i7-11370H_RAM_16GB_1TB_SSD_15.6-inch_FHD_144Hz_RTX____3050_Ti_4GB_WIN10-BLACK","N/A","N/A","N/A","N/A"
"Asus  ROG  Zephyrus  G14  GA401QM-HZ077T AMD Ryzen7 5800HS RAM 16GB 1TB SSD RTX 3060 6G FHD 144Hz Win10-Eclipse Grey","31500 LE","N/A"," Learn More about GeForce RTX 30  series: https://fb.watch/9NLKL7MBfn/Processor  AMD Ryzen™ 7 5800HS Processor 3.0 GHz (16M Cache, up to 4.3 GHz)  Memory  16GB DDR4 on board  Max Capacity :  24GB  Storage  1TB PCIE SSD  Graphics  NVIDIA® GeForce RTX™ 3060 Laptop GPU  With ROG Boost up to 1382MHz at 60W (80W with Dynamic Boost)  6GB GDDR5  Display  FHD (1920 x 1080) 144HZ 16:9  anti-glare display  sRGB:  100%  Adobe:  75.35%  IPS-level  Pantone Validated:  Yes  Keyboard and Touchpad  ILLUMINATED Chiclet Keyboard  Operating System  Windows 10 Home - ASUS recommends Windows 10 Pro for business  (Free upgrade to Windows 11, when available)   ضمان وكيل سنتين  ","https://www.sigma-computer.com/item?id=3330&name=Asus__ROG__Zephyrus__G14__GA401QM-HZ077T_AMD_Ryzen7_5800HS_RAM_16GB_1TB_SSD_RTX_3060_6G_FHD_144Hz_Win10-Eclipse_Grey","N/A","N/A","N/A","N/A"
"HP Pavilion Gaming Laptop 15-dk1056wm i5-10300H RAM 8 GB 256GB   1TB HDD SSD GTX 1650 4GB 15.6 FHD WIN 10","16499 LE","N/A"," Intel® Core™ i5-10300H (2.5 GHz base frequency, up to 4.5 GHz with Intel® Turbo Boost Technology, 8 MB L3 cache, 4 cores)  8 GB DDR4-2933 SDRAM (2 x 4 GB)  256 GB PCIe® NVMe™ M.2 SSD + 1TB HDD  15.6  diagonal, FHD (1920 x 1080), IPS, micro-edge, anti-glare, 250 nits, 45% NTSC  Windows 10 Home 64  GTX 1650 4GB  ","https://www.sigma-computer.com/item?id=3312&name=HP_Pavilion_Gaming_Laptop_15-dk1056wm_i5-10300H_RAM_8_GB_256GB___1TB_HDD_SSD_GTX_1650_4GB_15.6_FHD_WIN_10","N/A","N/A","N/A","N/A"
"HP Pavilion Gaming Laptop - 15-dk1042nia i7-10750H RAM 16GB 256 SSD 1 TB HDD 39.6 cm FHD GTX 1660Ti 6GB ","18700 LE","N/A"," Intel® Core™ i7-10750H (2.6 GHz base frequency, up to 5 GHz with Intel® Turbo Boost Technology, 12 MB L3 cache, 6 cores)  16 GB DDR4-2933 SDRAM (2 x 8 GB)  NVIDIA® GeForce® GTX 1660 Ti with Max-Q design (6 GB GDDR6 dedicated)  256 GB PCIe® NVMe™ M.2 SSD  1 TB 7200 rpm SATA HDD  39.6 cm (15.6 ) diagonal, FHD (1920 x 1080), IPS, micro-edge, anti-glare, 250 nits, 45% NTSC    ","https://www.sigma-computer.com/item?id=3310&name=HP_Pavilion_Gaming_Laptop_-_15-dk1042nia_i7-10750H_RAM_16GB_256_SSD_1_TB_HDD_39.6_cm_FHD_GTX_1660Ti_6GB_","N/A","N/A","N/A","N/A"
"REDRAGON H260 RGB GAMING HEADSET WITH MICROPHONE  WIRED  COMPATIBLE WITH XBOX ONE  NINTENDO SWITCH  PS4  PS5  PCS  LAPTOPS","899 LE"," In Stock  "," Multi-Platform Gaming Headset; compatible with Xbox One, Nintendo Switch (audio only), PlayStation, PS4, PS5, MAC, PC and Laptop   RGB Backlit; with built-in Volume control and omnidirectional Microphone  Crystal Clear Stereo Sound; The 50mm neodymium directional drivers with 110dB sensitivity deliver Crystal Clear audio precision, while the soft padded Closed ear cups offer advanced passive noise isolation  Lightweight and Comfortable; The headset offers ultimate comfort for prolonged gaming sessions through its low weight and Noise Reducing Closed Ear Cups using Soft Comfortable Signature Memory Foam with highly adjustable headband for perfect fit  Noise Cancelling Microphone; the Microphone offers optimized Noise and Echo Cancelling technology for your Voice Chat during gaming sessions. Comes with 6-foot-long high quality cable, gold plated 3.5mm Audio jack,3.5mm Mic jack & USB-A connector          ","https://www.sigma-computer.com/item?id=3274&name=REDRAGON_H260_RGB_GAMING_HEADSET_WITH_MICROPHONE__WIRED__COMPATIBLE_WITH_XBOX_ONE__NINTENDO_SWITCH__PS4__PS5__PCS__LAPTOPS","N/A","N/A","N/A","N/A"
"Lenovo H402 Gaming Headphone USB 7.1 Surround Sound Deep Bass RGB Colorful Headset Light with Mic for Laptop Gamer - 3.5 m USB","650 LE","N/A"," The 7.1 USB sound card provides exciting surround sound at separately adjustable levels.  The 50mm HiFi speaker features high sensitivity and accurate sound reduction, allowing you to receive any audio details and experience a realistic game battlefield. You can enjoy games greatly.  The light LED design is great, adds charm to the gameplay, looks more fashionable.     ","https://www.sigma-computer.com/item?id=3253&name=Lenovo_H402_Gaming_Headphone_USB_7.1_Surround_Sound_Deep_Bass_RGB_Colorful_Headset_Light_with_Mic_for_Laptop_Gamer_-_3.5_m_USB","N/A","N/A","N/A","N/A"
"CAT BIG BACKPACK-BIG-BLACK","750 LE","N/A"," Material : Nylon  Type : Laptop Backpacks  Targeted Group : Unisex  Are batteries needed to power the product or is this product a battery : 0  Is this a Dangerous Good or a Hazardous Material, Substance or Waste that is regulated for transportation, storage, and/or disposal? : 0  ","https://www.sigma-computer.com/item?id=3163&name=CAT_BIG_BACKPACK-BIG-BLACK","N/A","N/A","N/A","N/A"
"ASUS Webcam C3 USB with 1080p 30 fps recording","999 LE","N/A"," USB camera with 1080p 30 fps recording, beamforming microphone for better live-streaming video and audio quality, and adjustable clip that fits various devices  Sharp FHD (1920 x 1080) video output at a smooth 30 fps  Effectively reduces environmental noise for crystal-clear video calls, even while gaming  90° tilt‑adjustable clip fits a variety of laptop screens and desktop monitors, and 360° rotation mechanism enables flexible camera angles  Compatible with popular applications such as Skype, Microsoft® Teams and Zoom  Wide field of view – perfect for conferences, telecommuting, or chats with two or more parties sitting side-by-side  ","https://www.sigma-computer.com/item?id=3136&name=ASUS_Webcam_C3_USB_with_1080p_30_fps_recording","N/A","N/A","N/A","N/A"
"Logitech C505 HD Webcam with HD 720p video and a long-range mic - 960-001364","2399 LE","N/A"," Brand ‎Logitech Series ‎C505 Item model number ‎960-001363 Hardware Platform ‎Laptop, PC Item Weight ‎4.4 ounces Product Dimensions ‎2.62 x 2.87 x 1.26 inches Item Dimensions LxWxH ‎2.62 x 2.87 x 1.26 inches Color ‎Black Manufacturer ‎Logitech ASIN ‎B08BNJPVXG              ","https://www.sigma-computer.com/item?id=3059&name=Logitech_C505_HD_Webcam_with_HD_720p_video_and_a_long-range_mic_-_960-001364","N/A","N/A","N/A","N/A"
"HP Pavilion Gaming Laptop 16-a0028ne Core i5-10300H-RAM 8GB-256 SSD 1TB-40.9 cm FHD IPS-GTX 1650 4G","13400 LE","N/A"," Microprocessor  Intel® Core™ i5-10300H (2.5 GHz base frequency, up to 4.5 GHz with Intel® Turbo Boost Technology, 8 MB L3 cache, 4 cores)  Memory, standard  8 GB DDR4-2933 SDRAM (2 x 4 GB)Memory, standard  Hard drive  256 GB PCIe® NVMe™ M.2 SSD  1 TB 7200 rpm SATA HDD.  Display  40.9 cm (16.1 ) diagonal, FHD (1920 x 1080), IPS, micro-edge, anti-glare, 250 nits, 45% NTSC  GTX 1650 4GB  ","https://www.sigma-computer.com/item?id=3056&name=HP_Pavilion_Gaming_Laptop_16-a0028ne_Core_i5-10300H-RAM_8GB-256_SSD_1TB-40.9_cm_FHD_IPS-GTX_1650_4G","N/A","N/A","N/A","N/A"
"HP Laptop 15-da2007ne Core i5-10210U-RAM 4 GB-1 TB HDD-39.6 cm HD -GeForce MX110 2G","8800 LE","N/A"," Microprocessor  Intel® Core™ i5-10210U (1.6 GHz base frequency, up to 4.2 GHz base with Intel® Turbo Boost Technology, 6 MB cache, 4 cores)  Memory, standard  4 GB DDR4-2666 SDRAM (1 x 4 GB)  Hard drive  1 TB 5400 rpm SATA  Display  39.6 cm (15.6 ) diagonal HD SVA anti-glare micro-edge WLED-backlit (1366 x 768)  Graphics  Discrete: NVIDIA® GeForce® MX110 (2 GB GDDR5 dedicated)  Keyboard  Full-size island-style jet black keyboard with numeric keypad  Touchpad with multi-touch gesture support    ","https://www.sigma-computer.com/item?id=3053&name=HP_Laptop_15-da2007ne_Core_i5-10210U-RAM_4_GB-1_TB_HDD-39.6_cm_HD_-GeForce_MX110_2G","N/A","N/A","N/A","N/A"
"MSI LAPTOP GL65 Leopard-Core    i7 10750H-RAM 16G-512SSD-15.6 FHD 144Hz IPS-RTX 2070 8G-WIN 10","25500 LE","N/A"," Learn More about GeForce RTX 30  series: https://fb.watch/9NLKL7MBfn/  CPU Up to 10th Gen. Intel® Core™ i7 Processor OS Windows 10 Home DISPLAY 15.6  FHD (1920x1080), 144Hz, IPS-Level 15.6  FHD (1920x1080), 120Hz, IPS-Level GRAPHICS NVIDIA® GeForce® RTX 2070 SUPER™ With 8GB GDDR6 MEMORY DDR4-2666 Memory Type 2 Slots Number of SO-DIMM Slot Max 64GB Max Capacity STORAGE CAPABILITY 1x M.2 SSD Combo slot (NVMe PCIe Gen3 / SATA) 1x 2.5  SATA HDD KEYBOARD Per-Key RGB Backlight Keyboard  ضمان سنه   ","https://www.sigma-computer.com/item?id=3044&name=MSI_LAPTOP_GL65_Leopard-Core____i7_10750H-RAM_16G-512SSD-15.6_FHD_144Hz_IPS-RTX_2070_8G-WIN_10","N/A","N/A","N/A","N/A"
"HP Laptop 15-dw3046ne i5-1135G7 4 GB DDR4 256 SSD 15.6 ","9999 LE","N/A"," Intel Core i5-1135G7 ( 1.0 GHz base frequency, up to 3.6 GHz with Intel Turbo Boost Technology 6 MB L3 cache and 4 cores) NVIDIA® GeForce® MX350 2 GB 4 GB DDR4-2666 SDRAM 256 SSD 15.6  HD SVA eDP anti-glare WLED-backlit, 67% sRGB, 220 cd/m² (1366 x 768)60 Hz    ","https://www.sigma-computer.com/item?id=3036&name=HP_Laptop_15-dw3046ne_i5-1135G7_4_GB_DDR4_256_SSD_15.6_","N/A","N/A","N/A","N/A"
"Samsung 8GB 3200MHz DDR4 PC4-25600 non-ECC Unbuffered SoDIMM OEM Laptop Memory","625 LE","N/A"," SKU: M471A1G44BB0-CWE  Device Segment: Laptop  Type: DDR4 Memory  Capacity: 8 GB  Speed: 3200 MHz  ","https://www.sigma-computer.com/item?id=3033&name=Samsung_8GB_3200MHz_DDR4_PC4-25600_non-ECC_Unbuffered_SoDIMM_OEM_Laptop_Memory","N/A","N/A","N/A","N/A"
"HP Printer Cable USB-B To USB-A V2.0 Black 1.5M","150 LE"," In Stock  "," Up to 5 Gbps transfers data speed for USB 3.0 devices  Connects printers and all-in-one mechine with your PC and laptops  Constructed with corrosion-resistant, gold-plated connectors for optimal signal clarity and shielding to minimize interference  Compact size is easy to carry  Country of Origin: China  ","https://www.sigma-computer.com/item?id=3017&name=HP_Printer_Cable_USB-B_To_USB-A_V2.0_Black_1.5M","N/A","N/A","N/A","N/A"
"AULA F2088 Wired Mechanical Gaming Keyboard-BLUE SWITCH-black","975 LE","N/A"," Compatible Devices Laptop, PC, Desktop, MAC  Color Blue Switch  Brand AULA  Connectivity Technology USB-A  Style Gaming  Item Dimensions LxWxH 17.13 x 4.92 x 1.54 inches  Number of Keys 104  Number of Buttons 104        ","https://www.sigma-computer.com/item?id=2971&name=AULA_F2088_Wired_Mechanical_Gaming_Keyboard-BLUE_SWITCH-black","N/A","N/A","N/A","N/A"
"AULA F2088 Wired Mechanical Gaming Keyboard-BLUE SWITCH-SILVER","350 LE","N/A","    Compatible Devices Laptop, PC, Desktop, MAC Color Blue Switch Brand AULA Connectivity Technology USB-A Style Gaming Item Dimensions LxWxH 17.13 x 4.92 x 1.54 inches Number of Keys 104 Number of Buttons 104   ","https://www.sigma-computer.com/item?id=2970&name=AULA_F2088_Wired_Mechanical_Gaming_Keyboard-BLUE_SWITCH-SILVER","N/A","N/A","N/A","N/A"
"DELL G5 15-5500 Gaming Laptop - Intel Core I5-10300H - 8GB RAM - 256GB SSD - 15.6-inch FHD     4GB GTX 1650ti 4g-win10 ","14800 LE","N/A"," Processor  Intel® Core™i5-10300H Processor, 2.50 GHz (8MB Cache, up to 4.50 GHz, # of Cores: 4)  Memory  Installed Memory: 8 GB RAM DDR4-2933MHz, Dual-Channel  Display  15.6 inch FHD(1920x1080) 300nits WVA Anti-Glare LED Backlit Display(non-touch), 120Hz refresh rate  Graphics  Video Card: NVIDIA® GeForce® GTX 1650ti  4GB GDDR6  Storage  256GB M.2 PCIe NVMe Solid State Drive    ","https://www.sigma-computer.com/item?id=2940&name=DELL_G5_15-5500_Gaming_Laptop_-_Intel_Core_I5-10300H_-_8GB_RAM_-_256GB_SSD_-_15.6-inch_FHD_____4GB_GTX_1650ti_4g-win10_","Intel_Core_I5-10300H","8GB_RAM","256GB_SSD","15.6-inch_FHD_____4GB_GTX_1650ti_4g-win10_"
"DELL G5 15-5505 SE Gaming laptop - AMD Ryzen 5 4600h - 16GB RAM - 512GB SSD - 15.6-inch FHD -RX 5600M 6GB -win10-ky en","17000 LE","N/A","   AMD Ryzen™ 5 4600H, 3.0 GHz CPU  16GB DDR4 RAM, 512GB M.2 NVMe SSD  15.6-inch Anti-glare FHD LED-backlit Screen  AMD Radeon™ RX 5600M 6GB GDDR6  Killer™ Wi-Fi 6 AX1650 (2x2) 802.11ax, Bluetooth 5.1  1 x USB Type C, 2 x USB 2.0, 1 x USB 3.2, 1 x HDMI  3-Cell Battery, OS: Windows 10  ","https://www.sigma-computer.com/item?id=2939&name=DELL_G5_15-5505_SE_Gaming_laptop_-_AMD_Ryzen_5_4600h_-_16GB_RAM_-_512GB_SSD_-_15.6-inch_FHD_-RX_5600M_6GB_-win10-ky_en","AMD_Ryzen_5_4600h","16GB_RAM","512GB_SSD","15.6-inch_FHD_-RX_5600M_6GB_-win10-ky_en"
"HP Pavilion Gaming Laptop 15-ec1007ne AMD Ryzen    7 4800H-RAM 8 GB-256 GB M.2 SSD 1TB HDD-Display 15.6FHD-GTX 1650TI 4G ","16300 LE","N/A"," Processor  AMD Ryzen™ 7 4800H (2.9 GHz base clock, up to 4.2 GHz max boost clock, 8 MB L3 cache, 8 cores) 6,7   Memory  8 GB DDR4-3200 MHz RAM (2 x 4 GB)  (2 x 4 GB)  Internal drive  256 GB PCIe® NVMe™ TLC M.2 SSD  1 TB 7200 rpm SATA HDD  Optical drive  Optical drive not included  Display  39.6 cm (15.6 ) diagonal, FHD (1920 x 1080), micro-edge, anti-glare, 220 nits, 45% NTSC   17  ضمان وكيل   ","https://www.sigma-computer.com/item?id=2933&name=HP_Pavilion_Gaming_Laptop_15-ec1007ne_AMD_Ryzen____7_4800H-RAM_8_GB-256_GB_M.2_SSD_1TB_HDD-Display_15.6FHD-GTX_1650TI_4G_","N/A","N/A","N/A","N/A"
"HP Pavilion Gaming Laptop 15-ec1005ne AMD Ryzen    7 4800H-RAM 16 GB-HD 1T 256 SSD-Display 39.6 cm  15.6 GTX 1660 Ti with Max-Q ","17500 LE","N/A"," System features  Operating system  FreeDOS  Processor family  AMD Ryzen™ 7 processor  Processor  AMD Ryzen™ 7 4800H (2.9 GHz base clock, up to 4.2 GHz max boost clock, 8 MB L3 cache, 8 cores) 6,7   Chipset  AMD Integrated SoC  Memory  Memory  16 GB DDR4-3200 MHz RAM (2 x 8 GB) (2 x 8 GB)  Storage  Internal drive  256 GB PCIe® NVMe™ TLC M.2 SSD  1 TB 7200 rpm SATA HDD  Optical drive  Optical drive not included  Display and graphics  Display  39.6 cm (15.6 ) diagonal, FHD (1920 x 1080), micro-edge, anti-glare, 220 nits, 45% NTSC   17   ","https://www.sigma-computer.com/item?id=2887&name=HP_Pavilion_Gaming_Laptop_15-ec1005ne_AMD_Ryzen____7_4800H-RAM_16_GB-HD_1T_256_SSD-Display_39.6_cm__15.6_GTX_1660_Ti_with_Max-Q_","N/A","N/A","N/A","N/A"
"HP OMEN- 15-en0013dx-AMD Ryzen    7 4800H-RAM 8 GB -HD 512 GB SSD M.2-Display 144 Hz  IPS-VGA GTX1660 TI 6GB-WIN 10-ENG KEYBOARD ","18950 LE","N/A"," Product number  2V926UA  Product name  OMEN Laptop - 15-en0013dx  Microprocessor  AMD Ryzen™ 7 4800H (2.9 GHz base clock, up to 4.3 GHz max boost clock, 4 MB L2 cache, 8 cores)  Memory, standard  8 GB DDR4-3200 SDRAM (2 x 4 GB)  Hard drive  512 GB PCIe® NVMe™ M.2 SSD  [16,17]  Optical drive  Optical drive not included  Display  15.6  diagonal FHD, 144 Hz, IPS, anti-glare, micro-edge, WLED-backlit, 300 nits, 72% NTSC (1920 x 1080)  Wireless connectivity  Intel® Wi-Fi 6 AX 200 (2x2) and Bluetooth® 5 Combo (Supporting Gigabit file transfer speeds)  ","https://www.sigma-computer.com/item?id=2884&name=HP_OMEN-_15-en0013dx-AMD_Ryzen____7_4800H-RAM_8_GB_-HD_512_GB_SSD_M.2-Display_144_Hz__IPS-VGA_GTX1660_TI_6GB-WIN_10-ENG_KEYBOARD_","N/A","N/A","N/A","N/A"
