Title,Price,InStock,Description,Link,Processor,Memory,Storage,Graphics
"Lenovo IdeaPad 1 15IAU7 82QD00AVED Laptop  Intel Core I7-1255U  512GB SSD  8GB RAM  15.6 Inch  FHD Display  Integrated Intel Iris Xe  Windows 11 - Abyss Blue with Laptop Shoulder Bag  Black - T210","27499 LE"," In Stock  "," ضمـــان وكيـل سنتيـن   Display: 15.6-inch FHD (1920 x 1080) TN panel, anti-glare Processor: Intel Core i7-1255U (10 cores, up to 4.7 GHz) Cores: 10 (2 performance cores and 8 efficient cores) Threads: 12 Memory: 8GB DDR4 Storage: 512GB SSD Graphics: Integrated Intel Iris Xe Operating System: Windows 11          ","https://www.sigma-computer.com/item?id=6860&name=Lenovo_IdeaPad_1_15IAU7_82QD00AVED_Laptop__Intel_Core_I7-1255U__512GB_SSD__8GB_RAM__15.6_Inch__FHD_Display__Integrated_Intel_Iris_Xe__Windows_11_-_Abyss_Blue_with_Laptop_Shoulder_Bag__Black_-_T210","N/A","N/A","N/A","N/A"
"Samsung DDR5 SODIMM 8GB 1Rx16 PC5 - 4800MHz - CL40 - SC0 - 1010 - XT -  Laptop RAM","1399 LE","N/A","    Computer Memory Size 8 GB   RAM Memory Technology DDR5   Memory Speed 4800 MHz   Compatible Devices Laptop     ","https://www.sigma-computer.com/item?id=6858&name=Samsung_DDR5_SODIMM_8GB_1Rx16_PC5_-_4800MHz_-_CL40_-_SC0_-_1010_-_XT_-__Laptop_RAM","4800MHz","CL40","SC0","1010"
"ASUS Vivobook 15 A1502ZA-EJ005W Laptop 15.6-inch FHD Intel i5-12500H 8GB RAM 512GB SSD Intel UHD Graphics Win11 Quiet Blue","24499 LE","N/A"," ### **Operating System**  - Windows 11 Home ### **Processor**  - Intel Core i5-12500H, 2.5 GHz (up to 4.5 GHz, 4 Performance cores + 8 Efficient cores) ### **Graphics**  - Intel UHD Graphics ### **Display**  - 15.6-inch FHD (1920 x 1080)  - 60Hz  - 220 nits ### **Memory**  - 8GB DDR4  - Supports up to 16GB ### **Storage**  - 512GB M.2 NVMe PCIe 3.0 SSD ### **Ports**  - 1x USB 2.0  - 1x USB 3.2 Gen 1 Type-C  - 2x USB 3.2 Gen 1 Type-A  - 1x HDMI 1.4  - 1x Audio Jack  - 1x DC-in ### **Camera**  - 720p HD with privacy shutter ### **Audio**  - SonicMaster, built-in speaker, built-in microphone ### **Network**  - Wi-Fi 6 and Bluetooth 5.3 ### **Battery**  - 42WHrs, 3-cell ### **Power Supply**  - 65W AC Adapter ### **Security**  - BIOS Booting User Password Protection  - TPM (Trusted Platform Module)        ","https://www.sigma-computer.com/item?id=6852&name=ASUS_Vivobook_15_A1502ZA-EJ005W_Laptop_15.6-inch_FHD_Intel_i5-12500H_8GB_RAM_512GB_SSD_Intel_UHD_Graphics_Win11_Quiet_Blue","N/A","N/A","N/A","N/A"
"HP Victus 15-FA1097NE Gaming Laptop Intel Core i7-13700H     16GB Ram DDR4     M.2 NVMe 512GB     Nvidia RTX 4050 6GB     15.6 Inch FHD IPS 144Hz","48499 LE"," In Stock  ","  Processor: Intel Core i7-13700H, 13th Gen Memory: 16GB DDR4-3200 MHz Storage: 512GB PCIe Gen4 NVMe SSD Screen: 15.6  FHD, 144 Hz Graphics: NVIDIA GeForce RTX 4050 6GB TGP 60w Operating System: DOS Color: Mica Silver Keyboard: English/Arabic, Backlit Camera: 720p HD Weight: 2.29 kg Wireless: Wi-Fi 6, Bluetooth 5.3 Brightness: 250 nits Audio: B&O, Dual speakers, HP Audio Boost Ports: USB-A, USB-C, HDMI, RJ-45 Power Supply: 200 W AC adapter Battery: 4-Cell 70 Wh Lithium-Ion Warranty: 1 Year         ","https://www.sigma-computer.com/item?id=6848&name=HP_Victus_15-FA1097NE_Gaming_Laptop_Intel_Core_i7-13700H_____16GB_Ram_DDR4_____M.2_NVMe_512GB_____Nvidia_RTX_4050_6GB_____15.6_Inch_FHD_IPS_144Hz","N/A","N/A","N/A","N/A"
"Asus ROG Zephyrus G16 GU605MY-QR061W  Intel Core Ultra 9 185H  32GB RAM  2TB SSD  NVIDIA RTX 4090 graphics  16-inch 2.5K OLED screen  Windows 11 - Gray","169999 LE"," In Stock  "," ضمــــــان سنــــة   Operating System: Windows 11 Home Processor: Intel Core Ultra 9, 2.3 GHz (up to 5.1 GHz, 16 cores) Graphics Card: NVIDIA GeForce RTX 4090 Laptop GPU, 16GB GDDR6 Display: 16-inch 2.5K OLED, 240Hz refresh rate, 0.2ms response time Memory: 32GB LPDDR5X (16GB x 2) Storage: 2TB PCIe 4.0 NVMe SSD Ports: HDMI 2.1, 3x USB 3.2, USB-C, Thunderbolt 4, SD card reader Keyboard: Backlit Chiclet RGB Camera: 1080P FHD IR Camera Audio: Dolby Atmos, AI noise-canceling technology, Quad-speaker system Network: Wi-Fi 6E, Bluetooth 5.3 Battery: 90WHrs, 4-cell Li-ion Power Supply: 240W AC Adapter, 100W TYPE-C Adapter Security: BIOS passwords, TPM, McAfee free trial   ","https://www.sigma-computer.com/item?id=6847&name=Asus_ROG_Zephyrus_G16_GU605MY-QR061W__Intel_Core_Ultra_9_185H__32GB_RAM__2TB_SSD__NVIDIA_RTX_4090_graphics__16-inch_2.5K_OLED_screen__Windows_11_-_Gray","N/A","N/A","N/A","N/A"
"LAPTOP ASUS ROG Strix SCAR 18 G834JZR-N6027W - Intel   Core    i9-14900HX - NVIDIA   GeForce RTX    4080 12GB - 32GB DDR5-5600 - 1TB PCIe   4.0 NVMe -  18-inch 2.5K 240Hz - Windows 11.","133333 LE"," In Stock  "," ​ضمــــــان سنــــة ASUS ROG Strix SCAR 18 Highlights:  Processor: Intel® Core™ i9-14900HX (24 Cores, up to 5.8GHz) GPU: NVIDIA® GeForce RTX™ 4080 (12GB GDDR6, 175W) RAM: 32GB DDR5-5600 (Upgradable to 64GB) Storage: 1TB PCIe® 4.0 NVMe SSD Display: 18-inch 2.5K (2560x1600), 240Hz, G-SYNC, Dolby Vision, 100% DCI-P3 Ports: HDMI 2.1, Thunderbolt™ 4, USB-C (DisplayPort/Power Delivery), USB-A, 2.5G LAN Battery: 90WHrs, 330W adapter + 100W USB-C charging Features: RGB Per-Key Keyboard, Wi-Fi 6E, Dolby Atmos, MUX Switch   ","https://www.sigma-computer.com/item?id=6846&name=LAPTOP_ASUS_ROG_Strix_SCAR_18_G834JZR-N6027W_-_Intel___Core____i9-14900HX_-_NVIDIA___GeForce_RTX____4080_12GB_-_32GB_DDR5-5600_-_1TB_PCIe___4.0_NVMe_-__18-inch_2.5K_240Hz_-_Windows_11.","Intel___Core____i9-14900HX","NVIDIA___GeForce_RTX____4080_12GB","32GB_DDR5-5600","1TB_PCIe___4.0_NVMe"
"MSI Cyborg 15 A13VF Core i7-13620H-16GB 5200MHZ DDR5 RAM - 512GB SSD GEN4 - RTX 4060 8GB 15.6","53999 LE","N/A"," MSI, Cyborg 15 A13VF, Intel Core i7-13620H, 512GB SSD, 16GB Ram, Nvidia GeForce RTX 4060 8GB, 15.6  Inch, FHD, Win.11, The MSI Cyborg 15 A13VF embodies the next phase of gaming evolution with its futuristic mechanized exterior design. Dive into the world of games in cyberpunk style, flaunting sci-fi fashion, and outplaying opponents with revolutionary hardware. The laptop's translucent parts on the keyboard and chassis reveal parts of the internals, giving a glimpse into the future of gaming design. The cybernetic-like trims and language from top to bottom reimagine what the future entails.        ","https://www.sigma-computer.com/item?id=6845&name=MSI_Cyborg_15_A13VF_Core_i7-13620H-16GB_5200MHZ_DDR5_RAM_-_512GB_SSD_GEN4_-_RTX_4060_8GB_15.6","N/A","N/A","N/A","N/A"
"KLEVV DDR4 32GB  1x32GB  3200MHz CL22 1.2V SODIMM Laptop Ram Memory SK Hynix Chip  KD4BGSA80-32N220A ","2999 LE"," In Stock  ","    Brand KLEVV   Computer Memory Size 32 GB   RAM Memory Technology DDR4   Memory Speed 3200 MHz   Compatible Devices Laptop, Desktop           ","https://www.sigma-computer.com/item?id=6839&name=KLEVV_DDR4_32GB__1x32GB__3200MHz_CL22_1.2V_SODIMM_Laptop_Ram_Memory_SK_Hynix_Chip__KD4BGSA80-32N220A_","N/A","N/A","N/A","N/A"
"REDRAGON K552P KUMARA PRO RGB Wireless Gaming Mechanical Keyboard red Switches","1999 LE","N/A","    Wireless Made Easy – Enjoy the freedom of wireless with a 2.4G/ Bluetooth 5.0 connection and 3000mAh long-lasting battery capacity. Reliable and fast connects hassle-free with devices such as laptops, tablets, and even phones that support Bluetooth. Dual Mode Switch – Easily switch between wireless and wired modes with the mode switch on the side. Included USB-C cable gives you the option to go wired for competitive games.   Hot-Swappable RED Switches – Distinctive tactile RED switch offers fantastic audile typing feedback. Hot-swappable with other Redragon switches. Made to last with switches rated for 50 million keypresses.  LED RGB Backlit Mechanical Gaming Keyboard 18 different RGB lighting modes, 9 different colors, 5 backlight brightness levels, breathing speed. Precision engineered keycaps offering crystal clear uniform backlighting  Anti Ghosting, ALL 87 keys are conflict free n-Key Rollover for ultimate Gaming performance. 12 Multimedia keys, Non-Slip Ergonomic, splash-proof Design with adjustable typing angle, High-Speed USB cable with gold-plated corrosion free USB connector  Compact TKL Tenkeyless Ergonomic Designed Computer Keyboard Durable Metal-ABS Construction with Plate-mounted mechanical keys and switches that stand up during marathon FPS gaming sessions         ","https://www.sigma-computer.com/item?id=6778&name=REDRAGON_K552P_KUMARA_PRO_RGB_Wireless_Gaming_Mechanical_Keyboard_red_Switches","N/A","N/A","N/A","N/A"
"COUGAR-EGY  8000  backpack for men bags for school laptop backpack - waterproof backpack for a 15.6 -inch laptop with a USB port and tow way handle  - grey","449 LE"," In Stock  "," COUGAR-EGY Backpack for Men  Usage: Perfect for school, laptops, and daily use. Laptop Compatibility: Fits laptops up to 15.6 inches. Size: 12 x 35 x 45 cm Features:  Waterproof Material to protect your belongings. USB Port for convenient charging on the go. Two-Way Handle Design for versatile carrying options.   Color: Grey Model: 8000  This backpack combines practicality with style, making it ideal for students and professionals alike.        ","https://www.sigma-computer.com/item?id=6775&name=COUGAR-EGY__8000__backpack_for_men_bags_for_school_laptop_backpack_-_waterproof_backpack_for_a_15.6_-inch_laptop_with_a_USB_port_and_tow_way_handle__-_grey","N/A","N/A","N/A","N/A"
"COUGAR-EGY  8000  backpack for men bags for school laptop backpack - waterproof backpack for a 15.6 -inch laptop with a USB port and tow way handle  - blue","449 LE"," In Stock  ","    LOTS OF STORAGE SPACE   tow way handle   USB PORT         ","https://www.sigma-computer.com/item?id=6774&name=COUGAR-EGY__8000__backpack_for_men_bags_for_school_laptop_backpack_-_waterproof_backpack_for_a_15.6_-inch_laptop_with_a_USB_port_and_tow_way_handle__-_blue","N/A","N/A","N/A","N/A"
"COUGAR-EGY  8000  backpack for men bags for school laptop backpack - waterproof backpack for a 15.6 -inch laptop with a USB port and tow way handle  - Green","449 LE","N/A","  LOTS OF STORAGE SPACE   tow way handle   USB PORT         ","https://www.sigma-computer.com/item?id=6773&name=COUGAR-EGY__8000__backpack_for_men_bags_for_school_laptop_backpack_-_waterproof_backpack_for_a_15.6_-inch_laptop_with_a_USB_port_and_tow_way_handle__-_Green","N/A","N/A","N/A","N/A"
"MSI Modern 14 C12MO Thin and Light Laptop   14 Inch FHD IPS-Level   Intel Core i3-1215U   8GB RAM   256GB SSD   Intel   UHD Graphics   White Backlit Keyboard   Black","15888 LE"," In Stock  ","  ضمــــــان سنــــــة  Model Name MSI Modern 14 C12MO Thin and Light Laptop Processor Intel 12th Gen Alder Lake Core i3-1215U Memory Onboard DDR4 8GB (3200MHz) Storage 256GB NVMe PCIe SSD Graphics Card Intel UHD Graphics Display  14.0 Inch FHD (1920x1080), IPS-Level Operating System DOS Color Classic Black WARRANTY 1-Year Keyboard White Backlit Keyboard WLAN Intel Wi-Fi 6 AX201(2*2 ax) + BT5.2 Battery 3 cell, 39.3Whr I/O Ports 1x Type-C (USB3.2 Gen2 / DP) with PD charging 1x Type-A USB3.2 Gen2 2x Type-A USB2.0 1x Micro SD Card Reader 1x HDMI™ (4K @ 30Hz)  ","https://www.sigma-computer.com/item?id=6769&name=MSI_Modern_14_C12MO_Thin_and_Light_Laptop___14_Inch_FHD_IPS-Level___Intel_Core_i3-1215U___8GB_RAM___256GB_SSD___Intel___UHD_Graphics___White_Backlit_Keyboard___Black","N/A","N/A","N/A","N/A"
"MSI-KATANA 17 B13VGK i9-13900H-RAM 16G DDR5 5200mhz-HD512G M.2 Gen4 -VGA RTX 4070 8G DDR6-17.3-FHD IPS 144HZ-W11-41-NB-9S7-17L541-1205","77930 LE","N/A"," -13th Gen Intel® Core™ i9-13900H processor  -NVIDIA® GeForce RTX™ 4070 Laptop GPU  -16GB--2*8, DDR5-5200MHZ  -512GN*1 NVMe SSD PCIe Gen4  -17.3  FHD(1920x1080), 144Hz Refresh Rate, IPS-Level  -Windows 11 Home (MSI recommends Windows 11 Pro for business.)        ","https://www.sigma-computer.com/item?id=6768&name=MSI-KATANA_17_B13VGK_i9-13900H-RAM_16G_DDR5_5200mhz-HD512G_M.2_Gen4_-VGA_RTX_4070_8G_DDR6-17.3-FHD_IPS_144HZ-W11-41-NB-9S7-17L541-1205","N/A","N/A","N/A","N/A"
"MSI Cyborg 15 AI A1V Gaming   Content Creation Laptop   MSI AI Engine   Intel Core Ultra 7 155H   GeForce RTX 4060 8GB   16GB DDR5 RAM   512GB SSD   15.6 Inch FHD 144Hz IPS    Windows 11   RGB Backlit Keyboard","60999 LE","N/A"," MODEL NAME MSI Cyborg 15 AI A1V Gaming & Content Creation Laptop with MSI AI Engine  PROCESSOR Intel Core Ultra 7 155H with Intel® AI Boost (NPU) MEMORY 16GB DDR5 Dual-Channel Memory 8GBx2, Max 96GB Up to DDR5-5600 STORAGE 512GB NVMe PCIe Gen4 SSD GRAPHICS CARD NVIDIA® GeForce RTX™ 4060 Laptop GPU 8GB GDDR6 DISPLAY 15.6 Inch FHD (1920x1080), 144Hz, IPS-Level OPERATING SYSTEM Windows 11 COLOR Translucent Black KEYBOARD 4-Zone RGB Gaming Keyboard  WLAN Intel® Wi-Fi 6E AX211 BATTERY 3-Cell 53.5 Battery (Whr)        ","https://www.sigma-computer.com/item?id=6767&name=MSI_Cyborg_15_AI_A1V_Gaming___Content_Creation_Laptop___MSI_AI_Engine___Intel_Core_Ultra_7_155H___GeForce_RTX_4060_8GB___16GB_DDR5_RAM___512GB_SSD___15.6_Inch_FHD_144Hz_IPS____Windows_11___RGB_Backlit_Keyboard","N/A","N/A","N/A","N/A"
"MSI Vector 17 HX A14V - i9-14900HX - 32GB DDR5-5600 MHz - 1TB NVMe M.2 Gen4 - RTX 4080 12GB GDDR6 - 17.3 QHD 240Hz IPS - Windows 11","131845 LE","N/A"," The MSI Vector 17 HX A14VHG is a high-performance gaming laptop that excels in delivering immersive gaming and productivity experiences. Its Intel Core i9-14900HX processor, paired with the NVIDIA GeForce RTX 4080 GPU and a stunning 240Hz QHD+ display, ensures smooth gameplay, sharp visuals, and responsive performance. The advanced cooling system, Killer Wi-Fi 7, and robust connectivity options make it a versatile machine for both gamers and professionals.        ","https://www.sigma-computer.com/item?id=6766&name=MSI_Vector_17_HX_A14V_-_i9-14900HX_-_32GB_DDR5-5600_MHz_-_1TB_NVMe_M.2_Gen4_-_RTX_4080_12GB_GDDR6_-_17.3_QHD_240Hz_IPS_-_Windows_11","i9-14900HX","32GB_DDR5-5600_MHz","1TB_NVMe_M.2_Gen4","RTX_4080_12GB_GDDR6"
"LAPTOP AORUS 16X 9KG 43EEC54SH 2024 CPU RPL i7-13650HX RAM DDR5 4800 8GB 2 VGA RTX 4060 GDDR6 8G HDD 1tb SSD Gen4 16.0 QHD 165Hz DOS","65999 LE","N/A","     Brand: Gigabyt   Model : AORUS 16X 9KG 2024   CPU : ntel® Core™ i7-13650HX Processor (24M Cache, up to 4.9 GHz, 14 cores : 6 P-core and 8 E-core)   Video Graphics : NVIDIA® GeForce RTX™ 4060 Laptop GPU 8GB GDDR6       Display : 6.0“ 16:10 QHD 165Hz Display      System Memory :2x DDR5 Slots (DDR5-4800MHz, Up to 64GB) * 2 x SO-DIMM sockets for expansion      Storage : 2x M.2 SSD slots (Supports 2x PCIe® Gen4x4 NVMe™ M.2 SSD, Up to 4TB)            ","https://www.sigma-computer.com/item?id=6764&name=LAPTOP_AORUS_16X_9KG_43EEC54SH_2024_CPU_RPL_i7-13650HX_RAM_DDR5_4800_8GB_2_VGA_RTX_4060_GDDR6_8G_HDD_1tb_SSD_Gen4_16.0_QHD_165Hz_DOS","N/A","N/A","N/A","N/A"
"REDRAGON Microphone GM303","1349 LE"," In Stock  "," -Compatible with any PC or laptop with USB port  -RGB backlight  -Compact, lightweight and easy to use  -Easy setup and installation  -Noise-canceling microphone        ","https://www.sigma-computer.com/item?id=6752&name=REDRAGON_Microphone_GM303","N/A","N/A","N/A","N/A"
"KINGSTON 256G DataTraveler Exodia 256GB USB 3.2 Flash Memory USF-KG-256G-DTXM","799 LE","N/A","  USB 3.2 Gen 1 performance for easy access to laptops, desktop PCs, monitors and other digital devices. Quick transfers and convenient storage of documents, music, videos and more. Large loop easily attaches to key rings Practical cap protects the USB plug Available in capacities up to 256GB & Compatible devices: Windows 11,10, 8.1, 8         ","https://www.sigma-computer.com/item?id=6737&name=KINGSTON_256G_DataTraveler_Exodia_256GB_USB_3.2_Flash_Memory_USF-KG-256G-DTXM","N/A","N/A","N/A","N/A"
"ASUS TUF Gaming A15 FA506NF-HN005W Ryzen 5 7535HS-RTX 2050 4GB GDDR6-RAM 8GB DDR5 -512GB SSD-15.6 FHD IPS 144HZ","28899 LE","N/A"," Processor: AMD Ryzen 5 7535HS Processor 3.3GHz (19MB Cache, up to 4.55 GHz, 6 cores, 12 Threads)   Graphics: NVIDIA® GeForce RTX 2050 Laptop GPU, Up to 1670MHz at 60W (70W with Dynamic Boost), 4GB GDDR6   Memory: 8GB DDR5-5600 SO-DIMM x 2, Max Capacity: 32GB   Storage: 512GB PCIe® 4.0 NVMe M.2 SSD   Display: 15.6-inch, FHD (1920 x 1080) 16:9, Value IPS-level, Anti-glare display, sRGB:62.5%, Adobe:47.34%, Refresh Rate:144Hz, Adaptive-Sync, Optimus   Operating System: Windows        ","https://www.sigma-computer.com/item?id=6732&name=ASUS_TUF_Gaming_A15_FA506NF-HN005W_Ryzen_5_7535HS-RTX_2050_4GB_GDDR6-RAM_8GB_DDR5_-512GB_SSD-15.6_FHD_IPS_144HZ","N/A","N/A","N/A","N/A"
"ASUS TUF Gaming F15 FX507VU-LP163W - Intel Core i7-13620H - NVIDIA GeForce RTX 4050 6GB - 16GB DDR5  4800 MHz - 512GB PCIe 4.0 NVMe - 15.6-inch FHD 144HZ - Windows 11.","47999 LE"," In Stock  ","  ضمــــــان سنــــة Processor Intel Core i7-13620H  , 6 Cores, (up to 2.4 GHz) Graphics NVIDIA GeForce RTX 4050 Laptop GPU, 6GB Ram 16 GB, 2 x 8 GB, Dual-Channel DDR5, 4800 MHz Storage 512GB PCIe 4.0 NVMe M.2 SSD Display 15.6-inch, FHD (1920 x 1080), Refresh Rate: 144Hz  OS & Color Windows 11 - Jaeger Gray   ","https://www.sigma-computer.com/item?id=6730&name=ASUS_TUF_Gaming_F15_FX507VU-LP163W_-_Intel_Core_i7-13620H_-_NVIDIA_GeForce_RTX_4050_6GB_-_16GB_DDR5__4800_MHz_-_512GB_PCIe_4.0_NVMe_-_15.6-inch_FHD_144HZ_-_Windows_11.","Intel_Core_i7-13620H","NVIDIA_GeForce_RTX_4050_6GB","16GB_DDR5__4800_MHz","512GB_PCIe_4.0_NVMe"
"ASUS VivoBook Go 15 E1504FA-NJ005W Ryzen 5 7520U 8GB RAM 512GB M.2 AMD Radeon Graphics 15.6- Windows 11","19899 LE"," In Stock  "," ضمــــــان سنــــة The ASUS VivoBook Go 15 E1504FA-NJ005W is a lightweight laptop with solid specifications for everyday tasks. Key Specs:  Processor: AMD Ryzen 5 7520U (up to 4.3 GHz) Memory: 8GB LPDDR5 Storage: 512GB NVMe SSD Display: 15.6-inch FHD, Anti-glare Battery: 42WHrs Weight: 1.63 kg OS: Windows 11 Home  Ideal for students and professionals for daily use.  ","https://www.sigma-computer.com/item?id=6729&name=ASUS_VivoBook_Go_15_E1504FA-NJ005W_Ryzen_5_7520U_8GB_RAM_512GB_M.2_AMD_Radeon_Graphics_15.6-_Windows_11","N/A","N/A","N/A","N/A"
"Asus Vivobook 15 X1504VA-NJ005 Laptop  Intel Core i5-1335U  512GB SSD  8GB RAM  15.6 Inch  FHD  60Hz  Intel Iris Xe Graphics   FREEDOS - Quiet Blue","21799 LE"," In Stock  "," ضمــــــان سنــــة Asus Vivobook 15 X1504VA-NJ005 - Key Specs:  Processor: Intel Core i5-1335U (13th Gen) Storage: 512GB SSD Memory: 8GB RAM Display: 15.6  FHD (1920x1080), 60Hz Graphics: Intel® Iris® Xe Graphics  Operating System: FREEDOS Color: Quiet Blue         ","https://www.sigma-computer.com/item?id=6727&name=Asus_Vivobook_15_X1504VA-NJ005_Laptop__Intel_Core_i5-1335U__512GB_SSD__8GB_RAM__15.6_Inch__FHD__60Hz__Intel_Iris_Xe_Graphics___FREEDOS_-_Quiet_Blue","N/A","N/A","N/A","N/A"
"NOTEBOOK ASUS AMD VivoBook 15 D1502YA-NJ007W AMD Ryzen 7 7730U 8GB RAM 512GB SSD AMD Radeon Graphics 15.6 Inch FHD  1920 X 1080  IPS 60Hz Windows 11 Home Laptop","24444 LE"," In Stock  "," ASUS VivoBook 15 D1502YA-NJ007W  Processor: AMD Ryzen™ 7 7730U (2.0GHz, up to 4.5GHz, 8 cores, 16 threads) Graphics: AMD Radeon™ Graphics Display: 15.6  FHD (1920x1080), 60Hz, 250 nits, Anti-glare RAM: 8GB DDR4 (expandable to 16GB) Storage: 512GB M.2 NVMe SSD Ports: USB-C, 2x USB-A 3.2, 1x USB-A 2.0, HDMI 1.4, 3.5mm jack Keyboard: Chiclet, 1.35mm key travel Camera: 720p HD with privacy shutter Networking: Wi-Fi 5, Bluetooth 5.1 Battery: 42WHr, 3-cell Li-ion Weight: 1.70 kg OS: Windows 11 Home Features: MIL-STD 810H certified, Antimicrobial Guard Plus, MyASUS apps.         ","https://www.sigma-computer.com/item?id=6725&name=NOTEBOOK_ASUS_AMD_VivoBook_15_D1502YA-NJ007W_AMD_Ryzen_7_7730U_8GB_RAM_512GB_SSD_AMD_Radeon_Graphics_15.6_Inch_FHD__1920_X_1080__IPS_60Hz_Windows_11_Home_Laptop","N/A","N/A","N/A","N/A"
"ASUS Vivobook 15 X1504VA-NJ017W Laptop  15.6    FHD  1920 X 1080  Display 60Hz  Intel Core I7-1355U   Intel UHD Graphics  8GB RAM  512GB SSD  Windows 11 Home  Quiet Blue","24999 LE"," In Stock  "," ضمــــــان سنــــة The ASUS Vivobook 15 X1504VA-NJ017W is a solid laptop with the following key features:  Display: 15.6-inch Full HD (1920 x 1080) with a 60Hz refresh rate, providing good clarity for everyday tasks and media consumption. Processor: Intel Core i7-1355U, which offers strong performance for multitasking and demanding applications. Graphics: Intel UHD Graphics, suitable for general use and light gaming or graphic tasks. Memory: 8GB RAM, adequate for most tasks, though it might be limiting for heavy multitasking or memory-intensive applications. Storage: 512GB SSD, providing fast boot times and ample storage for files and applications. Operating System: Windows 11 Home, offering a modern interface and improved features.  The  Quiet Blue  color adds a nice aesthetic touch. This laptop would be great for students or professionals looking for a reliable and stylish machine for everyday use.        ","https://www.sigma-computer.com/item?id=6724&name=ASUS_Vivobook_15_X1504VA-NJ017W_Laptop__15.6____FHD__1920_X_1080__Display_60Hz__Intel_Core_I7-1355U___Intel_UHD_Graphics__8GB_RAM__512GB_SSD__Windows_11_Home__Quiet_Blue","N/A","N/A","N/A","N/A"
"ASUS Vivobook S 15 OLED K5504VA-MA007W  2023   Intel Core I7-13700H 13th Gen  15.6","38999 LE","N/A","  ASUS Vivobook S 15 OLED Wherever possibility takes you.   Unleash the possibilities with Vivobook S 15 OLED, the outstanding laptop for school, work or entertainment. With the awesome power of its 13th Gen Intel® Core™ i7 H-series processor and a high-capacity 512GB  SSD, any task is easy — work or play, anywhere, anytime. And everything will look its best on the world-leading 15.6-inch 2.8K 120 Hz1 OLED display! The super-stylish new design with its brilliant colors shouts your personality to the world. Explore further and faster with Vivobook S 15 OLED!         ","https://www.sigma-computer.com/item?id=6723&name=ASUS_Vivobook_S_15_OLED_K5504VA-MA007W__2023___Intel_Core_I7-13700H_13th_Gen__15.6","N/A","N/A","N/A","N/A"
"ASUS Zenbook 14 OLED UX3405MA-PP009WS Laptop 14-inch OLED 3K Intel Core Ultra 9 185H 16GB RAM 1TB SSD Intel Arc Graphics Win11 Blue","70777 LE"," In Stock  "," ضمــــــــان سنـــــة ASUS Zenbook 14 OLED UX3405MA - Key Specs        Processor: Intel® Core™ Ultra 9 185H (16 cores, 22 threads, up to 5.1 GHz) Graphics: Intel® Arc™ Graphics Display: 14-inch OLED, 3K (2880 x 1800), 120 Hz, 100% DCI-P3, HDR True Black 600 Memory: 16GB LPDDR5X Storage: 1TB PCIe 4.0 SSD Ports: 2x Thunderbolt™ 4, 1x USB 3.2 Type-A, 1x HDMI 2.1 Weight: 1.28 kg (2.82 lbs) Battery: 75WHrs, 4-cell Li-ion OS: Windows 11 Home               ","https://www.sigma-computer.com/item?id=6722&name=ASUS_Zenbook_14_OLED_UX3405MA-PP009WS_Laptop_14-inch_OLED_3K_Intel_Core_Ultra_9_185H_16GB_RAM_1TB_SSD_Intel_Arc_Graphics_Win11_Blue","N/A","N/A","N/A","N/A"
"SAMSUNG 990 PRO with Heatsink SSD 2TB  PCIe Gen4 M.2 2280 Internal Solid State Hard Drive  Seq. Read Speeds Up To 7 450MB s for High End Computing","9799 LE","N/A"," BLAZING SPEED. COOL VICTORY: Consider this a cheat code; Our Samsung 990 PRO Gen 4 with Heatsink SSD helps you reach near max performance* with lightning-fast speeds and Heatsink for improved temperature control REACH THE NEXT LEVEL: Gen4 steps up with faster transfer speeds and high-performance bandwidth; With a more than 55% improvement in random performance compared to 980 PRO, it’s here for heavy computing and faster loading THE FASTEST SSD FROM THE WORLD'S #1 FLASH MEMORY BRAND**: The speed you need for any occasion; With read and write speeds up to 7450/6900 MB/s* you’ll reach near max performance of PCIe 4.0*** powering through for any use PLAY WITHOUT LIMITS: Give yourself some space with storage capacities from 1TB to 4TB; Sync all your saves and reign supreme in gaming, video editing, data analysis and more MADE w/ PS5 IN MIND: Ultra-slim Integrated Heatsink is designed to dissipate heat from your device to stabilize its temperature and prevent performance issues; It’s compatible with PlayStation 5 and PCI-SIG D8 standard desktops and laptops  ","https://www.sigma-computer.com/item?id=6701&name=SAMSUNG_990_PRO_with_Heatsink_SSD_2TB__PCIe_Gen4_M.2_2280_Internal_Solid_State_Hard_Drive__Seq._Read_Speeds_Up_To_7_450MB_s_for_High_End_Computing","N/A","N/A","N/A","N/A"
