Title,Price,InStock,Description,Link,Processor,Memory,Storage,Graphics
"Laptop HP 15 GW0054nia - AMD Ryzen 3 3250U - AMD Radeon Graphics - 4GB DDR4 ADD RAM 8GB  12GB  - 1TB SATA HDD ADD 128GB SSD - 15.6 inch HD","16000 LE"," In Stock  "," HP 15 GW0054nia is a budget-friendly laptop designed for everyday computing tasks. Here's a breakdown of its specifications:  Processor: AMD Ryzen 3 3250U - This is a decent processor for everyday tasks like browsing, word processing, and light multitasking. Graphics: AMD Radeon Graphics - Integrated graphics are suitable for basic tasks and casual gaming, but don't expect to play demanding games. RAM: 12GB DDR4 - This is a good amount of RAM for multitasking and keeping multiple applications open simultaneously. Storage: 1TB SATA HDD + 128GB SSD - The combination of a large HDD and a fast SSD provides ample storage space and decent boot times. Display: 15.6-inch HD - The HD resolution is sufficient for most everyday tasks, but it might not be ideal for watching movies or working with high-resolution images.   ","https://www.sigma-computer.com/item?id=7795&name=Laptop_HP_15_GW0054nia_-_AMD_Ryzen_3_3250U_-_AMD_Radeon_Graphics_-_4GB_DDR4_ADD_RAM_8GB__12GB__-_1TB_SATA_HDD_ADD_128GB_SSD_-_15.6_inch_HD","AMD_Ryzen_3_3250U","AMD_Radeon_Graphics","4GB_DDR4_ADD_RAM_8GB__12GB_","1TB_SATA_HDD_ADD_128GB_SSD"
"Dell Inspiron 14-7440 2n1 Laptop - Intel Core 7 150U 10 Cores - Intel Graphics - 16GB DDR5-5200 RAM  1TB SSD  Intel Graphics  14","49499 LE"," In Stock  "," CPU: Intel Core i7-150U (10 cores) Graphics Card: Intel Graphics RAM: 16GB DDR5 5600MHz (2x8GB) Storage: 1TB M.2 NVMe Display: 14  FHD Touch (1920x1200), IPS, 250 nits OS: Windows 11 Features: Backlit keyboard, Fingerprint reader  ","https://www.sigma-computer.com/item?id=7789&name=Dell_Inspiron_14-7440_2n1_Laptop_-_Intel_Core_7_150U_10_Cores_-_Intel_Graphics_-_16GB_DDR5-5200_RAM__1TB_SSD__Intel_Graphics__14","N/A","N/A","N/A","N/A"
" HP Envy X360 16-ac0013dx Covertible 2n1 Laptop - Intel core Ultra 5 125U 12-cores - Intel Graphics - 16GB LPDDR5-6400 RAM 512GB SSD 16 WUXGA 1920X1200 IPS Touch Backlit Windows 11 - Glacier Silver","38499 LE"," In Stock  "," Processor: Intel Core Ultra 5 125U (12 cores, up to 4.3 GHz, 12 MB L3 cache) Graphics Card: Intel Graphics RAM: 16 GB LPDDR5-6400 MHz RAM (onboard) Storage: 512GB M.2 NVMe PCIe 4.0 SSD Screen: 16-inch WUXGA (1920 x 1200), multitouch-enabled, IPS, edge-to-edge glass, micro-edge, 300 nits, 62.5% sRGB Operating System: Windows 11 Home Battery: 4-cell 68Wh Li-ion polymer battery, 65W USB-C power adapter  ","https://www.sigma-computer.com/item?id=7788&name=_HP_Envy_X360_16-ac0013dx_Covertible_2n1_Laptop_-_Intel_core_Ultra_5_125U_12-cores_-_Intel_Graphics_-_16GB_LPDDR5-6400_RAM_512GB_SSD_16_WUXGA_1920X1200_IPS_Touch_Backlit_Windows_11_-_Glacier_Silver","Intel_core_Ultra_5_125U_12-cores","Intel_Graphics","16GB_LPDDR5-6400_RAM_512GB_SSD_16_WUXGA_1920X1200_IPS_Touch_Backlit_Windows_11","Glacier_Silver"
" HP Envy x360 15-EW1058WM 2-in-1 Laptop Intel Core I5-1335U 512GB SSD 8GB Ram Intel Iris Xe Graphics 15.6  Inch FHD Win. 11 - Mineral silver","32999 LE"," In Stock  "," Brand: HP Product Name: Envy x360 15-EW1058WM Product Number: 85S59UA Processor: Intel® Core™ i5-1335U Processor Generation: 13th generation Processor Details: (up to 4.6 GHz with Intel® Turbo Boost Technology, 12 MB L3 cache, 10 cores, 12 threads) Video Graphics: Intel® Iris® Xe Graphics RAM: 8 GB DDR4-3200 MHz RAM (2 x 4 GB) Hard Drive: 512 GB PCIe® NVMe™ M.2 SSD Display: 15.6  diagonal, FHD multitouch-enabled, IPS, edge-to-edge glass, micro-edge, 250 nits, 45% NTSC Display Resolution: 1920 x 1080 Operating System: Windows 11 Home Keyboard: Full-size, backlit, moonstone grey keyboard Battery: 3-cell, 51 Wh Li-ion polymer Webcam: HP True Vision 5MP IR camera with camera shutter, temporal noise reduction and integrated dual array digital microphones Connections:   1 USB Type-A 10Gbps signaling rate   1 USB Type-A 10Gbps signaling rate (HP Sleep and Charge)   2 Thunderbolt™ 4 with USB Type-C® 40Gbps signaling rate (USB Power Delivery, DisplayPort™ 1.4, HP Sleep and Charge)   1 HDMI 2.1   1 headphone/microphone combo   Dimensions: 358.90 x 229.10 x 18.54 mm Weight: 1.81 kg Colors: Mineral silver Warranty: 1 Year  ","https://www.sigma-computer.com/item?id=7785&name=_HP_Envy_x360_15-EW1058WM_2-in-1_Laptop_Intel_Core_I5-1335U_512GB_SSD_8GB_Ram_Intel_Iris_Xe_Graphics_15.6__Inch_FHD_Win._11_-_Mineral_silver","N/A","N/A","N/A","N/A"
"Laptop Lenovo IdeaPad Flex 5 14IAU7 82R700L5US - Intel   Core    i5-1235U - Integrated Intel   Iris   Xe - 8GB Soldered LPDDR4x-4266 - 512GB SSD M.2 - 14","29499 LE"," In Stock  "," Processor: Intel® Core™ i5-1235U, 10C (2P + 8E) / 12T, P-core 1.3 / 4.4GHz, E-core 0.9 / 3.3GHz, 12MB Graphics: Integrated Intel® Iris® Xe Graphics Memory: 8GB Soldered LPDDR4x-4266 Storage: 512GB SSD M.2 2242 PCIe® 4.0x4 NVMe® Display: 14  WUXGA (1920x1200) IPS 300nits Glossy, 45% NTSC, 60Hz, TÜV Low Blue Light, Glass, Touch Keyboard: Backlit, English (US) Battery: Integrated 52.5Wh Power Adapter: 65W Round Tip (3-pin) Case Color: Storm Grey Weight: Starting at 1.55 kg (3.42 lbs) Warranty: 1 Year  ","https://www.sigma-computer.com/item?id=7783&name=Laptop_Lenovo_IdeaPad_Flex_5_14IAU7_82R700L5US_-_Intel___Core____i5-1235U_-_Integrated_Intel___Iris___Xe_-_8GB_Soldered_LPDDR4x-4266_-_512GB_SSD_M.2_-_14","Intel___Core____i5-1235U","Integrated_Intel___Iris___Xe","8GB_Soldered_LPDDR4x-4266","512GB_SSD_M.2"
"LENOVO LOQ 15IAX9 83DV00FXUS Intel Core i7-13650HX - RTX 4060 8GB - 16GB DDR5 4800MHz - 512GB M.2 GEN4 - 15.6 FHD IPS 100 - 300nits sRGB 144Hz - white backlight keyboard- Windows 11","51999 LE"," In Stock  "," Lenovo LOQ 15IRX9 83DV00FXUS  Powerful gaming laptop featuring Intel® Core™ i7-13650HX processor, NVIDIA® GeForce RTX™ 4060 (8GB, 115W), 15.6  FHD 144Hz IPS display with G-SYNC®, and 16GB DDR5-4800 RAM (expandable to 32GB). Equipped with a 512GB PCIe 4.0 SSD, Wi-Fi 6, and a 60Wh battery, it offers fast performance and connectivity. Built with a durable Luna Grey PC-ABS chassis, it includes a backlit keyboard, AI-enhanced gaming, and MIL-STD-810H certification for reliability. Runs on Windows® 11 Home        ","https://www.sigma-computer.com/item?id=7782&name=LENOVO_LOQ_15IAX9_83DV00FXUS_Intel_Core_i7-13650HX_-_RTX_4060_8GB_-_16GB_DDR5_4800MHz_-_512GB_M.2_GEN4_-_15.6_FHD_IPS_100_-_300nits_sRGB_144Hz_-_white_backlight_keyboard-_Windows_11","RTX_4060_8GB","16GB_DDR5_4800MHz","512GB_M.2_GEN4","15.6_FHD_IPS_100"
"Laptop LENOVO Legion 5 16IRX9 83DG004JUS -  Intel   Core    i9-14900HX - NVIDIA   GeForce RTX    4060 8GB - 32GB DDR5-5600 - 1TB SSD M.2 - 16  WQXGA  2560x1600  IPS 100  sRGB  165Hz - Windows   11 - Keyboard 4-Zone RGB Backlit.","77499 LE"," In Stock  "," Processor: Intel® Core™ i9-14900HX, 24C (8P + 16E) / 32T, P-core 2.2 / 5.8GHz, E-core 1.6 / 4.1GHz, 36MB AI PC Category: AI-Powered Gaming PC Graphics: NVIDIA® GeForce RTX™ 4060 8GB GDDR6, Boost Clock 2370MHz, TGP 140W, 233 AI TOPS Memory: 32GB - 2x 16GB SO-DIMM DDR5-5600 Storage: 1TB SSD M.2 2280 PCIe® 4.0x4 NVMe® Display: 16  WQXGA (2560x1600) IPS 350nits Anti-glare, 100% sRGB, 165Hz, Dolby Vision®, G-SYNC®, Low Blue Light Keyboard: 4-Zone RGB Backlit, English (US) Operating System: Windows® 11 Home, English Battery: Integrated 80Wh Power Adapter: 230W Slim Tip (3-pin) Warranty: 1 Year  ","https://www.sigma-computer.com/item?id=7779&name=Laptop_LENOVO_Legion_5_16IRX9_83DG004JUS_-__Intel___Core____i9-14900HX_-_NVIDIA___GeForce_RTX____4060_8GB_-_32GB_DDR5-5600_-_1TB_SSD_M.2_-_16__WQXGA__2560x1600__IPS_100__sRGB__165Hz_-_Windows___11_-_Keyboard_4-Zone_RGB_Backlit.","_Intel___Core____i9-14900HX","NVIDIA___GeForce_RTX____4060_8GB","32GB_DDR5-5600","1TB_SSD_M.2"
"ARCTIC MX-6  2 g  - Ultimate Performance Thermal Paste for CPU  Consoles  Graphics Cards  laptops  Very high Thermal Conductivity  Long Durability  Non-Conductive","350 LE"," In Stock  "," ARCTIC MX-6 (2 g) thermal paste:  Viscosity: 45,000 poise Density: 2.6 g/cm³ Continuous Use Temperature: -50°C to 150°C Volume Resistivity: 1.8 x 10¹² Ω-cm Breakdown Voltage: 7.5 kV/mm Thermal Conductivity: FAQ (Specific details are not provided in the specs) Colour: Grey   ","https://www.sigma-computer.com/item?id=7761&name=ARCTIC_MX-6__2_g__-_Ultimate_Performance_Thermal_Paste_for_CPU__Consoles__Graphics_Cards__laptops__Very_high_Thermal_Conductivity__Long_Durability__Non-Conductive","N/A","N/A","N/A","N/A"
"Meetion MiniGo BT 2.4G Wireless Bluetooth With Transmission Technology White","749 LE"," In Stock  "," MEETION MiniGo BT Wireless Mini Mouse is a very compact and travel-friendly mouse. It features the following:  Dual Connectivity: Supports both 2.4GHz USB-A and Bluetooth connections. Compatible with Multiple Devices: Works with PC, Mac, Laptop, and iPad. 1200 DPI Sensitivity: Provides smooth and precise control. USB-C Rechargeable: No need for disposable batteries, easy to recharge. Compact Size: Perfect for kids, teens, or anyone who prefers small, efficient devices.  This mouse is ideal for anyone looking for a practical and portable option for daily use or travel.  ","https://www.sigma-computer.com/item?id=7731&name=Meetion_MiniGo_BT_2.4G_Wireless_Bluetooth_With_Transmission_Technology_White","N/A","N/A","N/A","N/A"
"Meetion MiniGo BT 2.4G Wireless Bluetooth With Transmission Technology Black","749 LE"," In Stock  "," MEETION MiniGo BT Wireless Mini Mouse is a very compact and travel-friendly mouse. It features the following:  Dual Connectivity: Supports both 2.4GHz USB-A and Bluetooth connections. Compatible with Multiple Devices: Works with PC, Mac, Laptop, and iPad. 1200 DPI Sensitivity: Provides smooth and precise control. USB-C Rechargeable: No need for disposable batteries, easy to recharge. Compact Size: Perfect for kids, teens, or anyone who prefers small, efficient devices.  This mouse is ideal for anyone looking for a practical and portable option for daily use or travel.  ","https://www.sigma-computer.com/item?id=7730&name=Meetion_MiniGo_BT_2.4G_Wireless_Bluetooth_With_Transmission_Technology_Black","N/A","N/A","N/A","N/A"
"Redragon H270 RGB Gaming Headset with Microphone Wired Compatible with Xbox One  Nintendo Switch  PS4  PS5  PC and Laptops  White ","1099 LE"," In Stock  "," Redragon H270 RGB Gaming Headset Key Specs:  Multi-Platform Compatibility: Works with Xbox One, PS4, PS5, Nintendo Switch (audio only), Mac, PC, and laptops. RGB Backlit: Dynamic lighting on both ear cups. Built-in Volume Control: Easy audio adjustments. Omnidirectional Rotatable Microphone: Adjustable mic with on/off indicator   ","https://www.sigma-computer.com/item?id=7664&name=Redragon_H270_RGB_Gaming_Headset_with_Microphone_Wired_Compatible_with_Xbox_One__Nintendo_Switch__PS4__PS5__PC_and_Laptops__White_","N/A","N/A","N/A","N/A"
"Redragon M814 Wireless Gaming Mouse  Tri-Mode 2.4G USB-C Bluetooth Ergonomic Mouse Gaming  8000 DPI  RGB Backlit  Fully Programmable  Rechargeable Wireless Computer Mouse for Laptop PC Mac","1399 LE"," In Stock  ","  3 Modes: Wired, 2.4GHz Wireless, Bluetooth 8000 DPI Sensor: Adjustable gaming-grade precision 8 Programmable Buttons: With on-board memory RGB Backlight: Ergonomic and stylish design         ","https://www.sigma-computer.com/item?id=7663&name=Redragon_M814_Wireless_Gaming_Mouse__Tri-Mode_2.4G_USB-C_Bluetooth_Ergonomic_Mouse_Gaming__8000_DPI__RGB_Backlit__Fully_Programmable__Rechargeable_Wireless_Computer_Mouse_for_Laptop_PC_Mac","N/A","N/A","N/A","N/A"
"Laptop Dell Vostro 3520 - Intel Core i5 1235U - Intel UHD Graphics - 8GB DDR4 2666MHz -256GB NVMe SSD - 15.6 inch FHD 120Hz","19199 LE","N/A"," ضمــــــان سنــــــة Processor   12th Generation Intel(R) Core( TM) i5-1235U (12MB Cache, up to 4.4 GHz, 10 cores)  Graphics  Intel(R) UHD Graphics  Memory   8GB, 1x8GB, DDR4, 2666MHz  Storage   256GB M.2 PCIe NVMe Solid Stat e Drive  Display  15.6 inch FHD (1920 x 1080) 120Hz 250 nits WVA Anti- Glare L ED Backlit Narrow Border Display              ","https://www.sigma-computer.com/item?id=7652&name=Laptop_Dell_Vostro_3520_-_Intel_Core_i5_1235U_-_Intel_UHD_Graphics_-_8GB_DDR4_2666MHz_-256GB_NVMe_SSD_-_15.6_inch_FHD_120Hz","Intel_Core_i5_1235U","Intel_UHD_Graphics","8GB_DDR4_2666MHz_-256GB_NVMe_SSD","15.6_inch_FHD_120Hz"
"HP Victus16-r1062ne Intel Core i5 14450HX-RTX 3050 6GB-16GB 5600Mhz DDR5-1TB SSD Gen4 -16.1 FHD IPS 144Hz","43999 LE"," In Stock  "," ضمــــــــان سنـــــــــة HP Victus 16-r1062ne laptop:  Processor: Intel Core i5-14450HX    	 Cores/Threads: 10 cores (6 performance cores + 4 efficient cores), 16 threads Cache: 24MB   Graphics Card: NVIDIA GeForce RTX 3050 with 6GB GDDR6 VRAM RAM: 16GB DDR5 (2 x 8GB modules) with a blazing-fast 5600 MHz speed Storage: 1TB SSD Gen4 (ultra-fast NVMe storage for quick boot and load times) Display: 16.1-inch FHD IPS display with a 144Hz refresh rate (provides smooth and vibrant visuals, perfect for gaming and content creation)         ","https://www.sigma-computer.com/item?id=7642&name=HP_Victus16-r1062ne_Intel_Core_i5_14450HX-RTX_3050_6GB-16GB_5600Mhz_DDR5-1TB_SSD_Gen4_-16.1_FHD_IPS_144Hz","N/A","N/A","N/A","N/A"
"HP Victus16-r1066ne Intel Core i5 14450HX-RTX 3050 6GB-16GB 5600Mhz DDR5-1TB SSD Gen4 -16.1 FHD IPS 144Hz","43499 LE"," In Stock  "," ضمــــــــان سنـــــــــــة HP Victus 16-r1066ne gaming laptop specifications updated:  Processor: Intel Core i5-14450HX    	 Cores/Threads: 10 cores (6 performance + 4 efficiency) / 16 threads Designed for high-performance gaming and multitasking   Graphics Card: NVIDIA GeForce RTX 3050 with 6GB of VRAM  	 Excellent for gaming, rendering, and other GPU-intensive tasks   RAM: 16GB DDR5 (2 x 8GB modules) at 5600MHz  	 Dual-channel configuration for optimized memory performance   Storage: 1TB SSD Gen4  	 Ultra-fast read/write speeds for quicker load times and system responsiveness   Display: 16.1-inch Full HD (1920x1080) IPS panel with a 144Hz refresh rate  	 Smooth, crisp visuals perfect for gaming and multimedia           ","https://www.sigma-computer.com/item?id=7641&name=HP_Victus16-r1066ne_Intel_Core_i5_14450HX-RTX_3050_6GB-16GB_5600Mhz_DDR5-1TB_SSD_Gen4_-16.1_FHD_IPS_144Hz","N/A","N/A","N/A","N/A"
"MSI Modern 15 F13MG Laptop - Intel Core i5-1335U - 8GB DDR4 3200MHz - 512GB SSD - Intel Iris Xe Graphics - 15.6 FHD  1920x1080  IPS-Level","21749 LE"," In Stock  "," ضمــــــان سنــــة   Model: MSI Modern 15 F13MG Processor: Intel Core i5-1335U (13th Gen, up to 4.60 GHz) ( 10 cores & 12 threads ) RAM: 8GB DDR4 Storage: 512GB NVMe SSD Graphics: Intel Iris Xe Graphics Display: 15.6  FHD (1920x1080) IPS-Level Connectivity: Wi-Fi 6E, Bluetooth v5.3 Ports: USB-A, USB-C, HDMI, RJ45, Micro SD OS: Free DOS Warranty: 1 Year         ","https://www.sigma-computer.com/item?id=7624&name=MSI_Modern_15_F13MG_Laptop_-_Intel_Core_i5-1335U_-_8GB_DDR4_3200MHz_-_512GB_SSD_-_Intel_Iris_Xe_Graphics_-_15.6_FHD__1920x1080__IPS-Level","Intel_Core_i5-1335U","8GB_DDR4_3200MHz","512GB_SSD","Intel_Iris_Xe_Graphics"
"Lenovo LOQ 15IRX9 83DV0071PS Laptop  Intel Core i7-13650HX  512GB SSD  16GB RAM  15.6 Inches  FHD IPS 144Hz Display  NVIDIA GeForce RTX 4050 GDDR6 6GB  FreeDos","46499 LE","N/A"," ضمــــــان سنــــــة Lenovo LOQ 15IRX9 Key Specs  Processor: Intel® Core™ i7-13650HX (14C/20T, up to 4.9GHz) GPU: NVIDIA® GeForce RTX™ 4050 (6GB GDDR6, 105W TGP, G-SYNC®) Display: 15.6  FHD IPS, 144Hz, 100% sRGB Memory: 16GB DDR5-4800 (upgradable to 32GB) Storage: 512GB PCIe® 4.0 SSD (supports up to 2TB) Battery: 60Wh Weight: 2.38 kg Connectivity: Wi-Fi 6, Bluetooth 5.2, HDMI® 2.1, USB-C® (140W PD) Durability: MIL-STD-810H certified   ","https://www.sigma-computer.com/item?id=7600&name=Lenovo_LOQ_15IRX9_83DV0071PS_Laptop__Intel_Core_i7-13650HX__512GB_SSD__16GB_RAM__15.6_Inches__FHD_IPS_144Hz_Display__NVIDIA_GeForce_RTX_4050_GDDR6_6GB__FreeDos","N/A","N/A","N/A","N/A"
"MSI-I9-Vector16 HX A14VHG-801EG Inte Core i9-14900HX- RTX4080 GDDR6 12GB - 32GB DDR5- 1TBNVMe PCIe Gen4x4- 16 QHD 240Hz- Win11Home","133999 LE"," In Stock  "," ضمـــــــان سنتـــــين وكــــــيل MSI Vector 16 HX A14VHG-801EG A high-performance laptop designed for gamers and professionals. Key Features:  Processor: Intel Core i9-14900HX (14 cores, 24 threads) Graphics Card: NVIDIA GeForce RTX 4080 (12GB GDDR6) RAM: 32GB DDR5 (expandable) Storage: 1TB NVMe PCIe Gen4x4 SSD Display: 16-inch QHD+ (2560x1600), 240Hz refresh rate, vibrant visuals Operating System: Windows 11 Home  Other Highlights:  Cooling System: Advanced cooling for sustained performance Connectivity: Latest Wi-Fi 6E and multiple ports for flexibility Design: Sleek and durable, ideal for mobility         ","https://www.sigma-computer.com/item?id=7583&name=MSI-I9-Vector16_HX_A14VHG-801EG_Inte_Core_i9-14900HX-_RTX4080_GDDR6_12GB_-_32GB_DDR5-_1TBNVMe_PCIe_Gen4x4-_16_QHD_240Hz-_Win11Home","N/A","N/A","N/A","N/A"
"MSI RAIDER 18 HX A14VIG 9S7-182232-471 Gaming Laptop Intel Core i9 14900HX 32GB RAM 2TB SSD 18 Inch QHD 240Hz 16GB NVIDIA RTX 4090 Win 11","176499 LE","N/A"," ضمـــــــان سنتـــــين وكــــــيل       MSI RAIDER 18 HX A14V Specifications:  Processor: Latest Intel® Core™ i9-14900HX (14th Gen, powerhouse performance). Graphics: Up to NVIDIA® GeForce RTX™ 4090 Laptop GPU (16GB GDDR6, NVIDIA DLSS 3, Ada Lovelace, Max-Q). Display: 18  UHD+ MiniLED (3840x2400), 16:10, 240Hz, 100% DCI-P3, VESA DisplayHDR™ 1000 Certified – stunning visuals with IPS-level panel. Operating System: Windows 11 Home / Pro (recommended Pro for business). Cooling: Cooler Boost 5 (dual fans, 6 heat pipes, 3D cooling stands). Battery: 99.9Whr for extended productivity. Sound: Premium 6-speaker system by Dynaudio for immersive audio. Webcam: IR FHD with shutter, HDR, and 3D Noise Reduction. Aesthetics: Mystic Light with Matrix Lightbar for next-level customization.         ","https://www.sigma-computer.com/item?id=7582&name=MSI_RAIDER_18_HX_A14VIG_9S7-182232-471_Gaming_Laptop_Intel_Core_i9_14900HX_32GB_RAM_2TB_SSD_18_Inch_QHD_240Hz_16GB_NVIDIA_RTX_4090_Win_11","N/A","N/A","N/A","N/A"
"Samsung M80D LS32DM801UUXEN Smart Monitor  32 Inch  4K AI Upscaling  UHD  60 Hz  360 Audio Mode  Includes Webcam  Screen with Speakers and Height Adjustment  Smart TV Apps with Remote Control","20999 LE"," In Stock  "," ضمــــــان ثلاث سنــــوات Samsung M80D Smart Monitor 32-Inch (LS32DM801UUXEN) Specifications:     Key Features:          Height-adjustable Smart AI monitor with built-in speakers and pivot function.          UHD resolution with 4K AI upscaling for fluid, razor-sharp images at 60 Hz refresh rate.     Smart Capabilities:          Easy wireless access to PC files and IoT device control via Smart Hub.          Access a variety of streaming services with directly selectable smart TV apps.     Connectivity:          Compatible with Xbox, PlayStation, PC, and laptops.          Ports: 1x HDMI, 1x USB-C, 1x USB-A.          Connectivity: WLAN, Bluetooth.          Includes a SolarCell remote control and webcam.     Advanced Display Features:          HDR10+ support for deeper blacks and enhanced brightness to reveal all details.          Eye Saver Mode to reduce blue light emissions.          Flicker-Free Technology to eliminate screen flickering.  Warranty 3-Year  ","https://www.sigma-computer.com/item?id=7529&name=Samsung_M80D_LS32DM801UUXEN_Smart_Monitor__32_Inch__4K_AI_Upscaling__UHD__60_Hz__360_Audio_Mode__Includes_Webcam__Screen_with_Speakers_and_Height_Adjustment__Smart_TV_Apps_with_Remote_Control","N/A","N/A","N/A","N/A"
"HP Victus 16-r0029nia  Intel Core i5-13500H  RAM 16GB  512GB SSD  NVIDIA RTX 3050 6GB  16.1 FHD IPS 144Hz  Performance blue","38999 LE","N/A","      Technical Specifications:   Processor (CPU):  Intel® Core™ i5-13500H Up to 4.7 GHz with Intel® Turbo Boost Technology 18 MB L3 cache 12 cores, 16 threads    Memory (RAM):  16 GB DDR5-5200 MT/s (2 x 8 GB) Transfer rates up to 5200 MT/s    Storage:  512 GB PCIe® Gen4 NVMe™ M.2 SSD    Graphics (GPU):  NVIDIA® GeForce RTX™ 3050 Laptop GPU 6 GB GDDR6 dedicated memory    Display:  16.1  diagonal (40.9 cm) FHD (1920 x 1080) resolution 144 Hz refresh rate IPS panel, micro-edge, anti-glare 250 nits brightness, 45% NTSC color gamut    Camera:  HP True Vision 1080p FHD camera Temporal noise reduction Dual-array digital microphones    Color:  Performance Blue with a chrome logo    Keyboard:  Arabic & English layout    Operating System (OS):  Without OS    Accessories:  None                ","https://www.sigma-computer.com/item?id=7525&name=HP_Victus_16-r0029nia__Intel_Core_i5-13500H__RAM_16GB__512GB_SSD__NVIDIA_RTX_3050_6GB__16.1_FHD_IPS_144Hz__Performance_blue","N/A","N/A","N/A","N/A"
"MSI B13VE i7-13620H 10C 16T  RAM 16G DDR4 3200Hz  2 8 -SSD 512G Gen4 RTX4050 6G 15.6-FHD-IPS-144Hz Blue Backlit-Arabic-1.86 kg-2Year Warranty","44999 LE","N/A"," MSI Thin 15 B13VE laptop specifications: Specifications:  Processor: Intel Core i7-13620H (10 Cores, 16 Threads) RAM: 16GB DDR4 3200MHz (2x8GB) Storage: 512GB SSD (Gen4) + 2.5  HDD/SSD slot Graphics Card: NVIDIA GeForce RTX 4050, 6GB GDDR6 (45W TGP) Display: 15.6  FHD (1920x1080), IPS, 144Hz Keyboard: Blue Backlit, Arabic layout Weight: 1.86 kg Warranty: 2 Years Model Code: THIN15B13VE-9S7-16R831-2614         ","https://www.sigma-computer.com/item?id=7508&name=MSI_B13VE_i7-13620H_10C_16T__RAM_16G_DDR4_3200Hz__2_8_-SSD_512G_Gen4_RTX4050_6G_15.6-FHD-IPS-144Hz_Blue_Backlit-Arabic-1.86_kg-2Year_Warranty","N/A","N/A","N/A","N/A"
"MSI Thin 15 B12UCX i5 12450H RTX2050 RAM 8G DDR4 3200Hz SSD 512G 15.6-FHD-IPS-144Hz Blue Backlit-Arabic 1.86 kg-2 Year warranty","27999 LE"," In Stock  "," ضمـــــــان سنتـــــين وكــــــيل MSI Thin 15 B12UCX is a powerful yet portable laptop, ideal for gamers, students, and creators. Specifications  Processor: Intel Core i5-12450H (12th Gen) Graphics: NVIDIA GeForce RTX 2050, excellent for gaming and creative work. Memory: 8GB DDR4 (3200MHz) – expandable for multitasking needs. Storage: 512GB SSD – fast boot times and ample storage. Display: 15.6  FHD IPS, 144Hz – smooth visuals and vibrant colors. Keyboard: Blue backlit, Arabic support – perfect for night use and regional preferences. Weight: 1.86 kg – lightweight for its power. Warranty: 2 years for peace of mind.   ","https://www.sigma-computer.com/item?id=7506&name=MSI_Thin_15_B12UCX_i5_12450H_RTX2050_RAM_8G_DDR4_3200Hz_SSD_512G_15.6-FHD-IPS-144Hz_Blue_Backlit-Arabic_1.86_kg-2_Year_warranty","N/A","N/A","N/A","N/A"
"ASUS TUF Gaming F15 FX507ZI4-LP34W  Intel Core i7-12700H NVIDIA RTX 4070 8GB  16GB DDR4 RAM  512GB SSD 15.6 Full HD  1920x1080  with 144Hz - WIN 11","61799 LE"," In Stock  "," ضمــــــان سنــــة ASUS TUF Gaming F15 FX507ZI4-LP34W  A beastly gaming laptop designed for enthusiasts. Here's a quick rundown:  Processor: Intel Core i7-12700H (14 cores, high-performance). Graphics Card: NVIDIA GeForce RTX 4070 (8GB GDDR6). Memory: 16GB DDR4 RAM, upgradeable. Storage: 512GB SSD (fast boot and load times). Display: 15.6  Full HD (1920x1080) with 144Hz refresh rate. OS: Windows 11 Home pre-installed. Build: Sturdy design in a sleek gray finish, ideal for gaming on the go.  This laptop is perfect for gamers, content creators, and power users seeking high performance with reliable build quality.        ","https://www.sigma-computer.com/item?id=7479&name=ASUS_TUF_Gaming_F15_FX507ZI4-LP34W__Intel_Core_i7-12700H_NVIDIA_RTX_4070_8GB__16GB_DDR4_RAM__512GB_SSD_15.6_Full_HD__1920x1080__with_144Hz_-_WIN_11","N/A","N/A","N/A","N/A"
"JSAUX- CV0011 8K 60HZ - 4K 120HZ HDMI TO HDMI ALUMINUM ALLOY CABLE - 3M - GREY","349 LE"," In Stock  "," JSAUX 8K@60Hz HDMI Cable - Premium Ultra-High-Definition Experience  Resolution & Performance: Supports 8K@60Hz, 4K, 1080p, and 720p resolutions with ultra-fast data transfer rates up to 48Gbps. Ideal for movies, gaming, and high-refresh-rate setups. Build Quality: Aluminum alloy housing with durable nylon braiding and corrosion-resistant gold connectors for superior video and audio transmission. Advanced Features:  	 HDR10, Dolby Atmos, and Dolby Vision support for lifelike visuals and immersive sound. ARC/eARC for enhanced audio return. Automatic Low Latency Mode (ALLM) and Variable Refresh Rate (VRR) for smooth, lag-free performance. Quick notification switching for seamless usage.   Compatibility: Works with Blu-ray players, Fire TV, Apple TV, PS5/PS4/PS3, Xbox consoles, Nintendo Switch, PCs, laptops, and monitors. Cable Length: 3 meters, suitable for versatile use in home or office setups.         ","https://www.sigma-computer.com/item?id=7478&name=JSAUX-_CV0011_8K_60HZ_-_4K_120HZ_HDMI_TO_HDMI_ALUMINUM_ALLOY_CABLE_-_3M_-_GREY","N/A","N/A","N/A","N/A"
"Hikvision E100N M.2 2280 SATA III SSD - 128GB  550MB-s Read - 440MB-s Write ","699 LE"," In Stock  "," ضمـــــــــان سنــــــــــة The E100N series solid state drive is the result of years of experience and expertise in storage technology and flash memory management. This product is designed to optimize computer operating systems, offering stable and fast data service by accelerating startup times and overall performance. Features  High R/W Speed (SATA Interface):  Max. Read Speed: Up to 560 MB/s   3D NAND Technology:  Provides higher capacity, performance, and stability   Vibration-Resistant Structure:  No mechanical components; electronic chip control ensures better data safety   Application Field:  Ideal for personal computers, laptops, and other devices.     ","https://www.sigma-computer.com/item?id=7453&name=Hikvision_E100N_M.2_2280_SATA_III_SSD_-_128GB__550MB-s_Read_-_440MB-s_Write_","N/A","N/A","N/A","N/A"
